{
  "schemaVersion": "2.0.0",
  "tool": {
    "name": "CineTrace",
    "version": "0.3.0"
  },
  "environment": {
    "browser": {
      "engine": "chromium",
      "version": "151.0.7922.34"
    },
    "os": {
      "platform": "darwin",
      "arch": "arm64",
      "release": "25.4.0"
    },
    "runtime": {
      "name": "node",
      "version": "v26.0.0"
    },
    "renderer": {
      "metricScope": "webgl-specific",
      "available": true,
      "api": "webgl2",
      "vendor": "WebKit",
      "renderer": "WebKit WebGL",
      "unmaskedVendor": "Google Inc. (Google)",
      "unmaskedRenderer": "ANGLE (Google, Vulkan 1.3.0 (SwiftShader Device (LLVM 10.0.0) (0x0000C0DE)), SwiftShader driver)"
    },
    "metricLabels": {
      "generic": [
        "overflow",
        "heading",
        "keyboard",
        "semantic-content",
        "primary-action",
        "overlay-collision",
        "reverse-drift",
        "reduced-motion",
        "page-errors"
      ],
      "engineSpecific": [
        "renderer-metadata",
        "forced-webgl-failure"
      ]
    }
  },
  "target": "https://odessis.in/",
  "generatedAt": "2026-09-02T02:16:55.846Z",
  "configuration": {
    "viewports": [
      {
        "name": "desktop",
        "width": 1440,
        "height": 900,
        "deviceScaleFactor": 1
      },
      {
        "name": "mobile",
        "width": 390,
        "height": 844,
        "deviceScaleFactor": 1
      }
    ],
    "steps": [
      0,
      0.25,
      0.5,
      0.75,
      1
    ],
    "direction": "both",
    "adapter": "./evidence/odessis-adapter.mjs",
    "selectors": {
      "primaryAction": "a[href], button",
      "noJsPrimaryAction": "a[href], button",
      "semanticContent": "main, body",
      "noJsSemanticContent": "main, body",
      "overlay": "[data-cinetrace-overlay]",
      "overlayTarget": "[data-cinetrace-protected]"
    },
    "forceWebglFailure": true,
    "checkReducedMotion": true,
    "controlRuns": 2,
    "browser": "chromium"
  },
  "verdict": {
    "pass": true,
    "defectCount": 0
  },
  "defects": [],
  "viewports": [
    {
      "viewport": {
        "name": "desktop",
        "width": 1440,
        "height": 900,
        "deviceScaleFactor": 1
      },
      "frames": [
        {
          "direction": "forward",
          "progress": 0,
          "screenshot": "images/0-desktop-forward-0.png",
          "screenshotDigest": "5de0848dcc53214f41b66f0ab25376acb6cb58d7a32f9b63d7c191a5704c02ec",
          "state": {
            "target": 0,
            "chapter": 0,
            "chapterId": "harbour",
            "foreground": "harbour-rope",
            "portraitFactor": 0,
            "camera": {
              "position": [
                -1,
                2.6,
                92
              ],
              "fov": 48,
              "aspect": 1.6
            }
          },
          "stateDigest": "df086c4ca43bd0e2",
          "overflow": {
            "pass": true,
            "viewportWidth": 1440,
            "documentWidth": 1440,
            "bodyWidth": 1483,
            "overflowPixels": 0,
            "clippedBodyOverflowPixels": 43,
            "scrollingElement": "html",
            "rootOverflowX": "hidden",
            "bodyOverflowX": "hidden",
            "offenders": [
              {
                "selector": "#grain",
                "left": -720,
                "right": 2160,
                "width": 2880
              },
              {
                "selector": "div.fg.fg--gate",
                "left": -43.2,
                "right": 1483.2,
                "width": 1526.4
              },
              {
                "selector": "div.fg.fg--curtain",
                "left": -43.2,
                "right": 1483.2,
                "width": 1526.4
              },
              {
                "selector": "div.fg.fg--grass",
                "left": -43.2,
                "right": 1483.2,
                "width": 1526.4
              },
              {
                "selector": "div.fg.fg--awning",
                "left": -43.2,
                "right": 1483.2,
                "width": 1526.4
              },
              {
                "selector": "div.fg.fg--mist",
                "left": -43.2,
                "right": 1483.2,
                "width": 1526.4
              },
              {
                "selector": "div.fg.fg--vine",
                "left": -43.2,
                "right": 1483.2,
                "width": 1526.4
              },
              {
                "selector": "div.fg.fg--laurel",
                "left": -43.2,
                "right": 1483.2,
                "width": 1526.4
              }
            ]
          },
          "semantics": {
            "pass": true,
            "selector": "main, body",
            "h1Count": 1,
            "hasMainLandmark": true,
            "meaningfulTextCharacters": 2558
          },
          "primaryAction": {
            "pass": true,
            "selector": "a[href], button",
            "found": true,
            "matchCount": 47,
            "visible": true,
            "enabled": true,
            "named": true,
            "destination": "#harbour",
            "tagName": "a"
          },
          "overlayCollision": {
            "checked": false,
            "pass": true,
            "overlaySelector": "[data-cinetrace-overlay]",
            "protectedSelector": "[data-cinetrace-protected]",
            "overlayCount": 0,
            "protectedCount": 0,
            "collisions": []
          }
        },
        {
          "direction": "forward",
          "progress": 0.25,
          "screenshot": "images/0-desktop-forward-0_25.png",
          "screenshotDigest": "8ce40094217f68c990eadb1b30cb0d8baf1213b3780df89c2b00fec569990a78",
          "state": {
            "target": 1.7506,
            "chapter": 2,
            "chapterId": "stoa",
            "foreground": "stoa-curtain",
            "portraitFactor": 0,
            "camera": {
              "position": [
                -2.4,
                10.93,
                -48.14
              ],
              "fov": 52.79,
              "aspect": 1.6
            }
          },
          "stateDigest": "669e03adbfb011d1",
          "overflow": {
            "pass": true,
            "viewportWidth": 1440,
            "documentWidth": 1440,
            "bodyWidth": 1483,
            "overflowPixels": 0,
            "clippedBodyOverflowPixels": 43,
            "scrollingElement": "html",
            "rootOverflowX": "hidden",
            "bodyOverflowX": "hidden",
            "offenders": [
              {
                "selector": "#grain",
                "left": -720,
                "right": 2160,
                "width": 2880
              },
              {
                "selector": "div.fg.fg--rope",
                "left": -43.2,
                "right": 1483.2,
                "width": 1526.4
              },
              {
                "selector": "div.fg.fg--gate",
                "left": -43.2,
                "right": 1483.2,
                "width": 1526.4
              },
              {
                "selector": "div.fg.fg--grass",
                "left": -43.2,
                "right": 1483.2,
                "width": 1526.4
              },
              {
                "selector": "div.fg.fg--awning",
                "left": -43.2,
                "right": 1483.2,
                "width": 1526.4
              },
              {
                "selector": "div.fg.fg--mist",
                "left": -43.2,
                "right": 1483.2,
                "width": 1526.4
              },
              {
                "selector": "div.fg.fg--vine",
                "left": -43.2,
                "right": 1483.2,
                "width": 1526.4
              },
              {
                "selector": "div.fg.fg--laurel",
                "left": -43.2,
                "right": 1483.2,
                "width": 1526.4
              }
            ]
          },
          "semantics": {
            "pass": true,
            "selector": "main, body",
            "h1Count": 1,
            "hasMainLandmark": true,
            "meaningfulTextCharacters": 2558
          },
          "primaryAction": {
            "pass": true,
            "selector": "a[href], button",
            "found": true,
            "matchCount": 47,
            "visible": true,
            "enabled": true,
            "named": true,
            "destination": "#harbour",
            "tagName": "a"
          },
          "overlayCollision": {
            "checked": false,
            "pass": true,
            "overlaySelector": "[data-cinetrace-overlay]",
            "protectedSelector": "[data-cinetrace-protected]",
            "overlayCount": 0,
            "protectedCount": 0,
            "collisions": []
          }
        },
        {
          "direction": "forward",
          "progress": 0.5,
          "screenshot": "images/0-desktop-forward-0_5.png",
          "screenshotDigest": "9ed3648fb49db14d7ca606bbc9849c8b6888a121e2e1a615d0c7fe8fc5c6680d",
          "state": {
            "target": 3.5002,
            "chapter": 4,
            "chapterId": "agora",
            "foreground": "agora-awning",
            "portraitFactor": 0,
            "camera": {
              "position": [
                -7.96,
                38.62,
                -250.07
              ],
              "fov": 53.9,
              "aspect": 1.6
            }
          },
          "stateDigest": "6bd4a6c5368f5600",
          "overflow": {
            "pass": true,
            "viewportWidth": 1440,
            "documentWidth": 1440,
            "bodyWidth": 1483,
            "overflowPixels": 0,
            "clippedBodyOverflowPixels": 43,
            "scrollingElement": "html",
            "rootOverflowX": "hidden",
            "bodyOverflowX": "hidden",
            "offenders": [
              {